{
  "strategy_id": "momentum_top10",
  "name": "動能前十策略（NASDAQ 市值前十）",
  "universe": "NASDAQ_TOP_MC",
  "top_n": 10,
  "alloc_pct": 10,
  "whole_shares": true,
  "stop_loss_pct": -8,
  "take_profit_pct": 25,
  "notify_on_trade": true,
  "rebalance": {
    "on_new_funds": true,
    "monthly": true
  },
  "filters": {
    "min_price": 5,
    "max_pe": 200,
    "min_volume": 1000000
  }
}
